key,source,raw_name,inci_name,cas_number,derived_term,derived_variation,derived_physical_form,ingredient_category,definition_display_name,cluster_id,cluster_reason,cluster_size,cosing_items_in_cluster,tgsc_items_in_cluster,sources_in_cluster
29e4b8f0d4e6f91c0c037f475fe63a5c9638e851,cosing,PSEUDOZYMA EPICOLA/SOYBEAN FLOUR/APRICOT KERNEL OIL/OLIVE FRUIT OIL/SWEET ALMOND OIL/SUNFLOWER SEED OIL/ARTEMISIA PRINCEPS EXTRACT FERMENT EXTRACT FILTRATE,PSEUDOZYMA EPICOLA/SOYBEAN FLOUR/APRICOT KERNEL OIL/OLIVE FRUIT OIL/SWEET ALMOND OIL/SUNFLOWER SEED OIL/ARTEMISIA PRINCEPS EXTRACT FERMENT EXTRACT FILTRATE,,Pseudozyma epicola,Seed Oil,Oil,Fermentation - Other,Pseudozyma epicola,composite:29e4b8f0d4e6f91c0c037f475fe63a5c9638e851,composite_item,1,1,0,cosing
2d18564e5f7e8d31a20d65b1c66618fb459fae9e,cosing,LACTOBACILLUS/RYE FLOUR FERMENT,LACTOBACILLUS/RYE FLOUR FERMENT,,Lactobacillus/rye FLOUR FERMENT,Ferment,Liquid,Fermentation - Other,Lactobacillus/rye FLOUR FERMENT,composite:2d18564e5f7e8d31a20d65b1c66618fb459fae9e,composite_item,1,1,0,cosing
373c24dc02e6af44afa322283fc6c716d2cd20e1,cosing,AGARICUS BLAZEI/SOY FLOUR/SUCROSE FERMENT EXTRACT,AGARICUS BLAZEI/SOY FLOUR/SUCROSE FERMENT EXTRACT,,Agaricus blazei,Ferment,Liquid,Marine - Botanicals,Agaricus blazei,composite:373c24dc02e6af44afa322283fc6c716d2cd20e1,composite_item,1,1,0,cosing
3b9bc878dcde0a07ae754da06e455b4f85f0252a,cosing,PSEUDOZYMA EPICOLA/SOYBEAN FLOUR/APRICOT KERNEL OIL/OLIVE FRUIT OIL/SUNFLOWER SEED OIL/SWEET ALMOND OIL/LEONURUS SIBIRICUS EXTRACT FERMENT EXTRACT FILTRATE,PSEUDOZYMA EPICOLA/SOYBEAN FLOUR/APRICOT KERNEL OIL/OLIVE FRUIT OIL/SUNFLOWER SEED OIL/SWEET ALMOND OIL/LEONURUS SIBIRICUS EXTRACT FERMENT EXTRACT FILTRATE,,Pseudozyma epicola,Seed Oil,Oil,Fermentation - Other,Pseudozyma epicola,composite:3b9bc878dcde0a07ae754da06e455b4f85f0252a,composite_item,1,1,0,cosing
4967a7f9e9db91a22d1651b4898f24d421e768b8,cosing,(LACTOBACILLUS/MILLET SEED FLOUR FERMENT & PANICUM MILIACEUM SEED EXTRACT) FILTRATE,(LACTOBACILLUS/MILLET SEED FLOUR FERMENT & PANICUM MILIACEUM SEED EXTRACT) FILTRATE,,(lactobacillus/millet SEED FLOUR FERMENT & PANICUM MILIACEUM SEED Extract) FILTRATE,Seed Extract,Liquid,Fermentation - Other,(lactobacillus/millet SEED FLOUR FERMENT & PANICUM MILIACEU…,composite:4967a7f9e9db91a22d1651b4898f24d421e768b8,composite_item,1,1,0,cosing
4f4589329fd666cad2e73ef00846795ff9927ebc,cosing,LACTOBACILLUS/AMARANTHUS CAUDATUS SEED FLOUR FERMENT FILTRATE,LACTOBACILLUS/AMARANTHUS CAUDATUS SEED FLOUR FERMENT FILTRATE,,Lactobacillus/amaranthus CAUDATUS SEED FLOUR FERMENT FILTRATE,Ferment Filtrate,Liquid,Fermentation - Other,Lactobacillus/amaranthus CAUDATUS SEED FLOUR FERMENT FILTRA…,composite:4f4589329fd666cad2e73ef00846795ff9927ebc,composite_item,1,1,0,cosing
6c58a3880d1cce6e991a3f21150ea21b67e1480a,cosing,ASPERGILLUS/POTATO STARCH/WHEAT FLOUR FERMENT FILTRATE,ASPERGILLUS/POTATO STARCH/WHEAT FLOUR FERMENT FILTRATE,,Aspergillus/potato Starch/wheat FLOUR FERMENT FILTRATE,Ferment Filtrate,Liquid,Fermentation - Other,Aspergillus/potato Starch/wheat FLOUR FERMENT FILTRATE,composite:6c58a3880d1cce6e991a3f21150ea21b67e1480a,composite_item,1,1,0,cosing
7b15e43846ef078dd65ae764f4f15b088f693e33,cosing,ASPERGILLUS/APRICOT KERNEL/ARTEMISIA ANNUA/AQUILARIA AGALLOCHA STEM/ELETTARIA CARDAMOMUM SEED/CORDYCEPS SINENSIS/HERICIUM ERINACEUM/POLYPORUS UMBELLATUS/WHEAT FLOUR/XANTHIUM STRUMARIUM FRUIT FERMENT EXTRACT FILTRATE,ASPERGILLUS/APRICOT KERNEL/ARTEMISIA ANNUA/AQUILARIA AGALLOCHA STEM/ELETTARIA CARDAMOMUM SEED/CORDYCEPS SINENSIS/HERICIUM ERINACEUM/POLYPORUS UMBELLATUS/WHEAT FLOUR/XANTHIUM STRUMARIUM FRUIT FERMENT EXTRACT FILTRATE,,Aspergillus/apricot Kernel/artemisia Annua/aquilaria AGALLOCHA Stem/elettaria CARDAMOMUM Seed/cordyceps Sinensis/hericium Erinaceum/polyporus Umbellatus/wheat Flour/xanthium STRUMARIUM FRUIT FERMENT EXTRACT FILTRATE,Ferment Filtrate,Liquid,Fermentation - Other,Aspergillus/apricot Kernel/artemisia Annua/aquilaria AGALLO…,composite:7b15e43846ef078dd65ae764f4f15b088f693e33,composite_item,1,1,0,cosing
82c227a65875bea71ba53877c2e56dcf04708543,cosing,PSEUDOZYMA EPICOLA/SOYBEAN FLOUR/APRICOT KERNEL OIL/OLIVE FRUIT OIL/SWEET ALMOND OIL/SUNFLOWER SEED OIL/LICORICE ROOT EXTRACT FERMENT EXTRACT FILTRATE,PSEUDOZYMA EPICOLA/SOYBEAN FLOUR/APRICOT KERNEL OIL/OLIVE FRUIT OIL/SWEET ALMOND OIL/SUNFLOWER SEED OIL/LICORICE ROOT EXTRACT FERMENT EXTRACT FILTRATE,,Pseudozyma epicola,Root Extract,Liquid,Fermentation - Other,Pseudozyma epicola,composite:82c227a65875bea71ba53877c2e56dcf04708543,composite_item,1,1,0,cosing
83be8bd158a80550315dcb4c5ca997da40ecace0,cosing,PANTOEA AGGLOMERANS/WHEAT FLOUR FERMENT EXTRACT,PANTOEA AGGLOMERANS/WHEAT FLOUR FERMENT EXTRACT,,Pantoea agglomerans,Ferment,Liquid,Fermentation - Other,Pantoea agglomerans,composite:83be8bd158a80550315dcb4c5ca997da40ecace0,composite_item,1,1,0,cosing
91ad9dca5d8db96d6265730269eb77dd0bf457e0,cosing,LACTOBACILLUS/RYE FLOUR FERMENT FILTRATE,LACTOBACILLUS/RYE FLOUR FERMENT FILTRATE,,Lactobacillus/rye FLOUR FERMENT FILTRATE,Ferment Filtrate,Liquid,Fermentation - Other,Lactobacillus/rye FLOUR FERMENT FILTRATE,composite:91ad9dca5d8db96d6265730269eb77dd0bf457e0,composite_item,1,1,0,cosing
98ff2652e5ee221d99a85ecfaa74f4185c2aa90c,cosing,PSEUDOZYMA EPICOLA/OLIVE FRUIT OIL/SOYBEAN FLOUR FERMENT FILTRATE,PSEUDOZYMA EPICOLA/OLIVE FRUIT OIL/SOYBEAN FLOUR FERMENT FILTRATE,,Pseudozyma epicola,Oil,Oil,Fermentation - Other,Pseudozyma epicola,composite:98ff2652e5ee221d99a85ecfaa74f4185c2aa90c,composite_item,1,1,0,cosing
9baab0cbb0ec4f41326a717412e9ba76318b88ed,cosing,PSEUDOZYMA EPICOLA/SOYBEAN FLOUR/APRICOT KERNEL OIL/OLIVE FRUIT OIL/SUNFLOWER SEED OIL/SWEET ALMOND OIL/ANGELICA GIGAS ROOT EXTRACT FERMENT EXTRACT FILTRATE,PSEUDOZYMA EPICOLA/SOYBEAN FLOUR/APRICOT KERNEL OIL/OLIVE FRUIT OIL/SUNFLOWER SEED OIL/SWEET ALMOND OIL/ANGELICA GIGAS ROOT EXTRACT FERMENT EXTRACT FILTRATE,,Pseudozyma epicola,Root Extract,Liquid,Fermentation - Other,Pseudozyma epicola,composite:9baab0cbb0ec4f41326a717412e9ba76318b88ed,composite_item,1,1,0,cosing
bfa4ccb10ff776692432db6dea4c9c27a169de81,cosing,PSEUDOZYMA EPICOLA/SOYBEAN FLOUR/APRICOT KERNEL OIL/OLIVE FRUIT OIL/SWEET ALMOND OIL/SUNFLOWER SEED OIL/LITHOSPERMUM ERYTHRORHIZON ROOT FERMENT EXTRACT FILTRATE,PSEUDOZYMA EPICOLA/SOYBEAN FLOUR/APRICOT KERNEL OIL/OLIVE FRUIT OIL/SWEET ALMOND OIL/SUNFLOWER SEED OIL/LITHOSPERMUM ERYTHRORHIZON ROOT FERMENT EXTRACT FILTRATE,,Pseudozyma epicola,Seed Oil,Oil,Fermentation - Other,Pseudozyma epicola,composite:bfa4ccb10ff776692432db6dea4c9c27a169de81,composite_item,1,1,0,cosing
c8311c4e274ca4f3abe7bce11fb5db13f1771eab,cosing,PSEUDOZYMA EPICOLA/CAMELLIA SINENSIS SEED OIL/GLUCOSE/MALT EXTRACT/SOYBEAN FLOUR/YEAST EXTRACT FERMENT FILTRATE,PSEUDOZYMA EPICOLA/CAMELLIA SINENSIS SEED OIL/GLUCOSE/MALT EXTRACT/SOYBEAN FLOUR/YEAST EXTRACT FERMENT FILTRATE,,Pseudozyma epicola sinensis,Seed Oil,Oil,Fermentation - Other,Pseudozyma epicola sinensis,composite:c8311c4e274ca4f3abe7bce11fb5db13f1771eab,composite_item,1,1,0,cosing
ce6e1224c9e317605ebea55764845ee621619c5c,tgsc,agaricus blazei/soy flour/sucrose ferment extract,,,Agaricus blazei,Ferment,Liquid,Marine - Botanicals,Agaricus blazei,composite:ce6e1224c9e317605ebea55764845ee621619c5c,composite_item,1,0,1,tgsc
cefaad7e8423cba3f47a43413531c36d3df0679d,cosing,PSEUDOZYMA EPICOLA/SOYBEAN FLOUR/APRICOT KERNEL OIL/OLIVE FRUIT OIL/SUNFLOWER SEED OIL/SWEET ALMOND OIL/PANAX GINSENG ROOT EXTRACT FERMENT EXTRACT FILTRATE,PSEUDOZYMA EPICOLA/SOYBEAN FLOUR/APRICOT KERNEL OIL/OLIVE FRUIT OIL/SUNFLOWER SEED OIL/SWEET ALMOND OIL/PANAX GINSENG ROOT EXTRACT FERMENT EXTRACT FILTRATE,,Pseudozyma epicola,Root Extract,Liquid,Fermentation - Other,Pseudozyma epicola,composite:cefaad7e8423cba3f47a43413531c36d3df0679d,composite_item,1,1,0,cosing
dc04ff2caf41a318e420fbeae2ec20cb6926fe2a,cosing,LACTOBACILLUS/MILLET SEED FLOUR FERMENT,LACTOBACILLUS/MILLET SEED FLOUR FERMENT,,Lactobacillus/millet SEED FLOUR FERMENT,Ferment,Liquid,Fermentation - Other,Lactobacillus/millet SEED FLOUR FERMENT,composite:dc04ff2caf41a318e420fbeae2ec20cb6926fe2a,composite_item,1,1,0,cosing
f99313fecce8a7b02efd5e07b5aa579ffe64404b,cosing,PSEUDOZYMA EPICOLA/SOYBEAN FLOUR/APRICOT KERNEL OIL/OLIVE FRUIT OIL/SUNFLOWER SEED OIL/SWEET ALMOND OIL/SAURURUS CHINENSIS EXTRACT FERMENT EXTRACT FILTRATE,PSEUDOZYMA EPICOLA/SOYBEAN FLOUR/APRICOT KERNEL OIL/OLIVE FRUIT OIL/SUNFLOWER SEED OIL/SWEET ALMOND OIL/SAURURUS CHINENSIS EXTRACT FERMENT EXTRACT FILTRATE,,Pseudozyma epicola,Seed Oil,Oil,Fermentation - Other,Pseudozyma epicola,composite:f99313fecce8a7b02efd5e07b5aa579ffe64404b,composite_item,1,1,0,cosing
332a52a8c85c55c39a8747ae6a46a5a64a78419e,cosing,ARACHIS HYPOGAEA FLOUR,ARACHIS HYPOGAEA FLOUR,8002-03-7,Arachis hypogaea,Flour,Powder,Grains,Peanut,term:arachis hypogaea,post_merge_term_cluster,1,1,0,cosing
35d7af93337c4b79efcafc6f15e87d5ca9b360e2,cosing,ARACHIS HYPOGAEA FRUIT EXTRACT,ARACHIS HYPOGAEA FRUIT EXTRACT,8002-03-7,Arachis hypogaea,Fruit Extract,Liquid,Herbs,Peanut,term:arachis hypogaea,post_merge_term_cluster,1,1,0,cosing
d99b993094e7ca22ba90554f2ac6183817d3d888,cosing,ARACHIS HYPOGAEA OIL,ARACHIS HYPOGAEA OIL,8002-03-7,Arachis hypogaea,Oil,Oil,Herbs,Peanut,term:arachis hypogaea,post_merge_term_cluster,1,1,0,cosing
002bc1a64ced1e16b1e6843ab8f502ab7adb06bc,tgsc,"arachis hypogaea fruit extract,",,8002-03-7,Arachis hypogaea,Fruit Extract,Liquid,Herbs,Peanut,term:arachis hypogaea,post_merge_term_cluster,1,1,0,cosing
f91bbf42eec173ee478bc8e8e5cc7de2bb780082,tgsc,"arachis hypogaea oil CO2 extract,",,8002-03-7,Arachis hypogaea,CO2 Extract,Liquid,Herbs,Peanut,term:arachis hypogaea,post_merge_term_cluster,1,1,0,cosing
2dc5313140148000200067039fb5858a189c1fe0,tgsc,artocarpus altilis flour,,,Artocarpus altilis,Flour,Powder,Grains,Artocarpus altilis,term:artocarpus altilis,post_merge_term_cluster,1,0,1,tgsc
3f5008794953a40d51527159dada2170e707c326,cosing,AVENA SATIVA KERNEL EXTRACT,AVENA SATIVA KERNEL EXTRACT,84012-26-0,Avena sativa,Kernel Extract,Liquid,Herbs,Oat,term:avena sativa kernel,post_merge_term_cluster,1,1,0,cosing
20eeb12f1c56868c746f7c1a3daa9537dfb05c09,cosing,AVENA SATIVA KERNEL FLOUR,AVENA SATIVA KERNEL FLOUR,134134-86-4,Avena sativa,Flour,Powder,Grains,Oat Flour,term:avena sativa kernel,post_merge_term_cluster,1,1,0,cosing
8c14a65005466d53ba98f4d11e742f9490fcc70b,cosing,AVENA SATIVA KERNEL MEAL,AVENA SATIVA KERNEL MEAL,84012-26-0,Avena sativa,Meal,Powder,Herbs,Oat,term:avena sativa kernel,post_merge_term_cluster,1,1,0,cosing
4d3a54c9969f431284b08250931502bacb12fea8,cosing,AVENA SATIVA KERNEL OIL,AVENA SATIVA KERNEL OIL,84012-26-0,Avena sativa,Kernel Oil,Oil,Seeds,Oat,term:avena sativa kernel,post_merge_term_cluster,1,1,0,cosing
6313cd5be66a7c81e9e9e4a2db4582dda4588306,cosing,AVENA SATIVA KERNEL PROTEIN,AVENA SATIVA KERNEL PROTEIN,134134-87-5,Avena sativa,Protein,Solid,Herbs,Oat Kernel Protein,term:avena sativa kernel,post_merge_term_cluster,1,1,0,cosing
a7a04b12e6e47b511440c3517332a55ac8b2b052,tgsc,"avena sativa kernel extract,",,84012-26-0,Avena sativa,Kernel Extract,Liquid,Herbs,Oat,term:avena sativa kernel,post_merge_term_cluster,1,1,0,cosing
854c0b0a2124d1b637a2c8c803531609097fee94,cosing,GLYCINE SOJA EXTRACT,GLYCINE SOJA EXTRACT,84776-91-0,Glycine soja,Extract,Liquid,Herbs,Soybean,term:glycine soja,post_merge_term_cluster,1,1,0,cosing
d7a1ca89c780cddf52714c87bc42742e6968f0dc,cosing,GLYCINE SOJA FLOUR,GLYCINE SOJA FLOUR,68513-95-1,Glycine soja,Flour,Powder,Grains,Glycine soja,term:glycine soja,post_merge_term_cluster,1,1,0,cosing
a81508c2d18ed9ec71252b824f197942c49b706a,cosing,GLYCINE SOJA OIL,GLYCINE SOJA OIL,8001-22-7,Glycine soja,Oil,Oil,Herbs,Soybean,term:glycine soja,post_merge_term_cluster,1,1,0,cosing
6f642dac273b6408e97b457bc0210f062f560b9c,cosing,GLYCINE SOJA OIL UNSAPONIFIABLES,GLYCINE SOJA OIL UNSAPONIFIABLES,91770-67-1,Glycine soja,Unsaponifiables,Oil,Herbs,Glycine Soja Oil Unsaponifiables,term:glycine soja,post_merge_term_cluster,1,1,0,cosing
7caf486a9658da42da728a011cd5163b3aa1c031,cosing,GLYCINE SOJA SEED,GLYCINE SOJA SEED,,Glycine soja,Seed,Whole,Herbs,Glycine soja,term:glycine soja,post_merge_term_cluster,1,1,0,cosing
61dccc716879700537388385e76f9b7eff6957c7,cosing,GLYCINE SOJA SEED EXTRACT,GLYCINE SOJA SEED EXTRACT,,Glycine soja,Seed Extract,Liquid,Herbs,Glycine soja,term:glycine soja,post_merge_term_cluster,1,1,0,cosing
6b7499813b59d3d7b84bbf620a300567d17bec8b,cosing,GLYCINE SOJA SEED POWDER,GLYCINE SOJA SEED POWDER,,Glycine soja,Seed Powder,Powder,Herbs,Glycine soja,term:glycine soja,post_merge_term_cluster,1,1,0,cosing
755b7cfe1827c75b0629ba0b6ea41879adafd219,cosing,GLYCINE SOJA SEED WATER,GLYCINE SOJA SEED WATER,,Glycine soja,Hydrosol,Hydrosol,Herbs,Glycine soja,term:glycine soja,post_merge_term_cluster,1,1,0,cosing
cc279eadcbfcb3bac6b4a27c20bbb8437e6604ad,tgsc,"glycine soja oil unsaponifiables,",,91770-67-1,Glycine soja,Unsaponifiables,Oil,Herbs,Glycine Soja Oil Unsaponifiables,term:glycine soja,post_merge_term_cluster,1,1,0,cosing
0a39e269790fad0ba02a7886c9d1f4d4bc59fa5c,tgsc,"glycine soja seed oil,",,8001-22-7,Glycine soja,Seed Oil,Oil,Seeds,Soybean,term:glycine soja,post_merge_term_cluster,1,1,0,cosing
0c4c881ec205e5c38ba6a534af6796d4f999d02b,cosing,HELIANTHUS ANNUUS CALLUS CONDITIONED MEDIA,HELIANTHUS ANNUUS CALLUS CONDITIONED MEDIA,,Helianthus annuus,Conditioned Media,Liquid,Fermentation - Other,Helianthus annuus,term:helianthus annuus,post_merge_term_cluster,1,1,0,cosing
75dc390929003eb6d986c98f61482ad3e7fec55e,cosing,HELIANTHUS ANNUUS CALLUS CULTURE EXTRACT,HELIANTHUS ANNUUS CALLUS CULTURE EXTRACT,,Helianthus annuus,Callus Culture,Liquid,Fermentation - Other,Helianthus annuus,term:helianthus annuus,post_merge_term_cluster,1,1,0,cosing
43d94a1aa344fdcc080ae0f716e245d97adbf380,cosing,HELIANTHUS ANNUUS EXTRACT,HELIANTHUS ANNUUS EXTRACT,84776-03-4,Helianthus annuus,Extract,Liquid,Herbs,Helianthus Annuus Seed Butter,term:helianthus annuus,post_merge_term_cluster,1,1,0,cosing
35d3d97260bbf7960b0a34a6233b19ca9fc2d300,cosing,HELIANTHUS ANNUUS FLOWER,HELIANTHUS ANNUUS FLOWER,,Helianthus annuus,Flower,Whole,Herbs,Helianthus annuus,term:helianthus annuus,post_merge_term_cluster,1,1,0,cosing
cfe8650bd63980097952fe64bf8f905e2377b306,cosing,HELIANTHUS ANNUUS FLOWER EXTRACT,HELIANTHUS ANNUUS FLOWER EXTRACT,84776-03-4,Helianthus annuus,Flower Extract,Liquid,Herbs,Helianthus Annuus Seed Butter,term:helianthus annuus,post_merge_term_cluster,1,1,0,cosing
80a45532620464754f42749de04deb17b31abb07,cosing,HELIANTHUS ANNUUS HYBRID OIL,HELIANTHUS ANNUUS HYBRID OIL,164250-88-8,Helianthus annuus,Oil,Oil,Herbs,Helianthus Annuus Hybrid,term:helianthus annuus,post_merge_term_cluster,1,1,0,cosing
061d125cff410bd2667d200fb51214b500d6532d,cosing,HELIANTHUS ANNUUS SEED,HELIANTHUS ANNUUS SEED,84625-38-7,Helianthus annuus,Seed,Whole,Herbs,Helianthus annuus,term:helianthus annuus,post_merge_term_cluster,1,1,0,cosing
db01df5677859fc802677655b9ed36e305239b59,cosing,HELIANTHUS ANNUUS SEED ACID,HELIANTHUS ANNUUS SEED ACID,84625-38-7,Helianthus annuus,Acid,Solid,Acids,Helianthus annuus,term:helianthus annuus,post_merge_term_cluster,1,1,0,cosing
094f530b4c28c6f5195d31f3be18c6ec671cb12a,cosing,HELIANTHUS ANNUUS SEED BUTTER,HELIANTHUS ANNUUS SEED BUTTER,,Helianthus annuus,,Butter,Herbs,Helianthus annuus,term:helianthus annuus,post_merge_term_cluster,1,1,0,cosing
cf1ac54d515132b2fc3193d2282e75fcfd2d2f4d,cosing,HELIANTHUS ANNUUS SEED CERA,HELIANTHUS ANNUUS SEED CERA,68937-99-5,Helianthus annuus,Wax,Wax,Herbs,Helianthus annuus,term:helianthus annuus,post_merge_term_cluster,1,1,0,cosing
e3e5cc7b4664ac8c76feabc1d5b626bae0a62481,cosing,HELIANTHUS ANNUUS SEED EXTRACT,HELIANTHUS ANNUUS SEED EXTRACT,84776-03-4,Helianthus annuus,Seed Extract,Liquid,Herbs,Helianthus Annuus Seed Butter,term:helianthus annuus,post_merge_term_cluster,1,1,0,cosing
c9136b2a08e47c00bbae2a9b9575a4046ffa7aa3,cosing,HELIANTHUS ANNUUS SEED FLOUR,HELIANTHUS ANNUUS SEED FLOUR,8001-21-6,Helianthus annuus,Flour,Powder,Grains,Sunflower,term:helianthus annuus,post_merge_term_cluster,1,1,0,cosing
3a22d39a78f845ade23aecfb11472b2ea1742689,cosing,HELIANTHUS ANNUUS SEED OIL UNSAPONIFIABLES,HELIANTHUS ANNUUS SEED OIL UNSAPONIFIABLES,8001-21-6,Helianthus annuus,Unsaponifiables,Oil,Seeds,Sunflower,term:helianthus annuus,post_merge_term_cluster,1,1,0,cosing
1494885a1bc64f0e6eee877246229765204987bb,cosing,HELIANTHUS ANNUUS SEED WAX,HELIANTHUS ANNUUS SEED WAX,1286686-34-7,Helianthus annuus,Wax,Wax,Herbs,Helianthus annuus,term:helianthus annuus,post_merge_term_cluster,1,1,0,cosing
de25d0691edd9469a007d45f898fdba9681a3b8e,tgsc,"helianthus annuus hybrid oil,",,164250-88-8,Helianthus annuus,Oil,Oil,Herbs,Helianthus Annuus Hybrid,term:helianthus annuus,post_merge_term_cluster,1,1,0,cosing
982c85aef3187937c16dfb516f204e2f3e286216,tgsc,"helianthus annuus seed butter,",,84776-03-4,Helianthus annuus,,Butter,Herbs,Helianthus Annuus Seed Butter,term:helianthus annuus,post_merge_term_cluster,1,1,0,cosing
0d231872b72a08c1ad3afff8fe2894b43ba604c8,tgsc,"helianthus annuus seed oil unsaponifiables,",,8001-21-6,Helianthus annuus,Unsaponifiables,Oil,Seeds,Sunflower,term:helianthus annuus,post_merge_term_cluster,1,1,0,cosing
434773dd408ed93a0b189373cd8ad13261784347,cosing,HORDEUM DISTICHON EXTRACT,HORDEUM DISTICHON EXTRACT,94349-67-4,Hordeum distichon,Extract,Liquid,Herbs,Hordeum distichon,term:hordeum distichon,post_merge_term_cluster,1,1,0,cosing
1c32d2ddece1ebd60ae5f447b3f9c32fdca876ee,cosing,HORDEUM DISTICHON SEED FLOUR,HORDEUM DISTICHON SEED FLOUR,94349-67-4,Hordeum distichon,Flour,Powder,Grains,Hordeum distichon,term:hordeum distichon,post_merge_term_cluster,1,1,0,cosing
475b756d387ae89b826453609d689cdcfae4f941,cosing,HORDEUM VULGARE FLOUR,HORDEUM VULGARE FLOUR,85251-64-5,Hordeum vulgare,Flour,Powder,Grains,Hordeum vulgare,term:hordeum vulgare seed,post_merge_term_cluster,2,2,0,cosing
6a0d5622fcd99fb6b8ee44275fb89810747673ff,cosing,HORDEUM VULGARE SEED EXTRACT,HORDEUM VULGARE SEED EXTRACT,85251-64-5,Hordeum vulgare,Seed Extract,Liquid,Herbs,Hordeum vulgare,term:hordeum vulgare seed,post_merge_term_cluster,2,2,0,cosing
7cba22a07b1831dae0da9b157733d77215d87378,cosing,HORDEUM VULGARE SEED FLOUR,HORDEUM VULGARE SEED FLOUR,85251-64-5,Hordeum vulgare,Flour,Powder,Grains,Hordeum vulgare,term:hordeum vulgare seed,post_merge_term_cluster,2,2,0,cosing
45655021819d2892797a0917f5716ab4f9a52f72,cosing,HYDROLYZED OAT FLOUR,HYDROLYZED OAT FLOUR,,Hydrolyzed oat,Hydrolyzed,Liquid,Grains,Hydrolyzed oat,term:hydrolyzed oat,post_merge_term_cluster,1,1,0,cosing
58b8b8a4fea5ec929afcb4a44f23c02cfb4b5e04,cosing,HYDROLYZED SOY,HYDROLYZED SOY,235433-33-7,Hydrolyzed soy,Hydrolyzed,Liquid,Herbs,Hydrolyzed soy,term:hydrolyzed soy,post_merge_term_cluster,1,1,0,cosing
21100624812eeee59b9465ac3600bd2b503e7202,cosing,HYDROLYZED SOY EXTRACT,HYDROLYZED SOY EXTRACT,,Hydrolyzed soy,Hydrolyzed,Liquid,Herbs,Hydrolyzed soy,term:hydrolyzed soy,post_merge_term_cluster,1,1,0,cosing
9fb744ed4765bfc595a29f220c749aa5cda2e6a2,cosing,HYDROLYZED SOY FLOUR,HYDROLYZED SOY FLOUR,,Hydrolyzed soy,Hydrolyzed,Liquid,Grains,Hydrolyzed soy,term:hydrolyzed soy,post_merge_term_cluster,1,1,0,cosing
80396368893422b3ca9cb22950245c12c21d0dde,cosing,HYDROLYZED SOY STARCH,HYDROLYZED SOY STARCH,68412-29-3,Hydrolyzed soy,Hydrolyzed,Liquid,Grains,Hydrolyzed soy,term:hydrolyzed soy,post_merge_term_cluster,1,1,0,cosing
ba0b7589a7605288e1659c05114290fe3e1f3474,cosing,HYDROLYZED WHEAT FLOUR,HYDROLYZED WHEAT FLOUR,,Hydrolyzed wheat,Hydrolyzed,Liquid,Grains,Hydrolyzed wheat,term:hydrolyzed wheat,post_merge_term_cluster,1,1,0,cosing
92c066b7ac4e226ff6400686f2cecfdc0a912cde,cosing,HYDROLYZED WHEAT STARCH,HYDROLYZED WHEAT STARCH,68412-29-3,Hydrolyzed wheat,Hydrolyzed,Liquid,Grains,Hydrolyzed wheat,term:hydrolyzed wheat,post_merge_term_cluster,1,1,0,cosing
7897292dd3c08a0c50d60844c1b8cf947ec211ac,cosing,LINUM USITATISSIMUM SEED EXTRACT,LINUM USITATISSIMUM SEED EXTRACT,8001-26-1,Linum usitatissimum,Seed Extract,Liquid,Herbs,Linseed,term:linum usitatissimum seed,post_merge_term_cluster,1,1,0,cosing
84d733c295ae6f8a6ace811f6ac08bb38525c069,cosing,LINUM USITATISSIMUM SEED FLOUR,LINUM USITATISSIMUM SEED FLOUR,8001-26-1,Linum usitatissimum,Flour,Powder,Grains,Linseed,term:linum usitatissimum seed,post_merge_term_cluster,1,1,0,cosing
cceac24db9b347aeb7b0865ac8aa9dd917caa7ca,cosing,LINUM USITATISSIMUM SEED OIL,LINUM USITATISSIMUM SEED OIL,8001-26-1,Linum usitatissimum,Seed Oil,Oil,Seeds,Linseed,term:linum usitatissimum seed,post_merge_term_cluster,1,1,0,cosing
7bbb493e10b607c3db04594d8c8cfe9ccc739be5,cosing,LINUM USITATISSIMUM SEED POWDER,LINUM USITATISSIMUM SEED POWDER,8001-26-1,Linum usitatissimum,Seed Powder,Powder,Herbs,Linseed,term:linum usitatissimum seed,post_merge_term_cluster,1,1,0,cosing
9e415033a8fda1a695570d38683aa0f86886bcca,cosing,MALT FLOUR,MALT FLOUR,,Malt Flour,Flour,Powder,Grains,Malt Flour,term:malt flour,post_merge_term_cluster,1,1,0,cosing
17ae899cc67af8270d2537dcc00d4ff3cb6a07e5,tgsc,"oat flour,",,134134-86-4,Oat Flour,Flour,Powder,Grains,Oat Flour,term:oat flour,post_merge_term_cluster,1,0,1,tgsc
b5dccfb81634669ace2fc375ed9abc772d32e236,cosing,PANICUM MILIACEUM EXTRACT,PANICUM MILIACEUM EXTRACT,90082-36-3,Panicum miliaceum,Extract,Liquid,Herbs,Panicum Miliaceum Seed,term:panicum miliaceum,post_merge_term_cluster,1,1,0,cosing
d6bb488c42d9f6457b27ac53d6d85c7291fa7ab6,cosing,PANICUM MILIACEUM SEED EXTRACT,PANICUM MILIACEUM SEED EXTRACT,90082-36-3,Panicum miliaceum,Seed Extract,Liquid,Herbs,Panicum Miliaceum Seed,term:panicum miliaceum,post_merge_term_cluster,1,1,0,cosing
b3c688e6b67c19414ee3a2a46fcdd962add10750,cosing,PANICUM MILIACEUM SEED FLOUR,PANICUM MILIACEUM SEED FLOUR,90082-36-3,Panicum miliaceum,Flour,Powder,Grains,Panicum Miliaceum Seed,term:panicum miliaceum,post_merge_term_cluster,1,1,0,cosing
6c72abb0ef9dd03843b6ef52f7dd74c770e334a3,cosing,PANICUM MILIACEUM SEED OIL,PANICUM MILIACEUM SEED OIL,90082-36-3,Panicum miliaceum,Seed Oil,Oil,Seeds,Panicum Miliaceum Seed,term:panicum miliaceum,post_merge_term_cluster,1,1,0,cosing
246642ca72f4f409383e698b1b604592745342a5,tgsc,"panicum miliaceum seed oil CO2 extract,",,90082-36-3,Panicum miliaceum,CO2 Extract,Liquid,Seeds,Panicum Miliaceum Seed,term:panicum miliaceum,post_merge_term_cluster,1,1,0,cosing
eae393079a9b4b02777360c29b895d90596a25cc,tgsc,"panicum miliaceum seed oil,",,90082-36-3,Panicum miliaceum,Seed Oil,Oil,Seeds,Panicum Miliaceum Seed,term:panicum miliaceum,post_merge_term_cluster,1,1,0,cosing
59cda9521f6900a444df37c9847d3302a6855169,tgsc,"peanut flour,",,8002-03-7,Peanut Flour,Flour,Powder,Grains,Peanut,term:peanut flour,post_merge_term_cluster,1,0,1,tgsc
d68a28950077f580cd022a8e94d33f1e527fdd46,cosing,POLYGONUM FAGOPYRUM CALLUS CULTURE EXTRACT,POLYGONUM FAGOPYRUM CALLUS CULTURE EXTRACT,89958-09-8,Polygonum fagopyrum,Callus Culture,Liquid,Fermentation - Other,Polygonum fagopyrum,term:polygonum fagopyrum,post_merge_term_cluster,1,1,0,cosing
93db8239e4f9f93437b5600fc8d6615fc5d0d553,cosing,POLYGONUM FAGOPYRUM FLOUR,POLYGONUM FAGOPYRUM FLOUR,89958-09-8,Polygonum fagopyrum,Flour,Powder,Synthetic - Polymers,Polygonum fagopyrum,term:polygonum fagopyrum,post_merge_term_cluster,1,1,0,cosing
3c632c94312b80fcb7067502272a0b415b5f6c91,cosing,POLYGONUM FAGOPYRUM LEAF EXTRACT,POLYGONUM FAGOPYRUM LEAF EXTRACT,89958-09-8,Polygonum fagopyrum,Leaf Extract,Liquid,Synthetic - Polymers,Polygonum fagopyrum,term:polygonum fagopyrum,post_merge_term_cluster,1,1,0,cosing
21361f8475b277772c46ac1db171ba88f4582f5d,cosing,POLYGONUM FAGOPYRUM SEED EXTRACT,POLYGONUM FAGOPYRUM SEED EXTRACT,89958-09-8,Polygonum fagopyrum,Seed Extract,Liquid,Synthetic - Polymers,Polygonum fagopyrum,term:polygonum fagopyrum,post_merge_term_cluster,1,1,0,cosing
a7d8d68704e02c0719e092461300af27d8623bf0,cosing,POLYGONUM FAGOPYRUM STEM EXTRACT,POLYGONUM FAGOPYRUM STEM EXTRACT,89958-09-8,Polygonum fagopyrum,Stem Extract,Liquid,Synthetic - Polymers,Polygonum fagopyrum,term:polygonum fagopyrum,post_merge_term_cluster,1,1,0,cosing
607c3920de31d5c69f59c68524c5fdc8ae99a078,cosing,SECALE CEREALE CALLUS EXTRACT,SECALE CEREALE CALLUS EXTRACT,,Secale cereale,Callus,Liquid,Herbs,Secale cereale,term:secale cereale,post_merge_term_cluster,1,1,0,cosing
330ce282b17ca92f6d4d558bcd8e9f207bd43473,cosing,SECALE CEREALE SEED EXTRACT,SECALE CEREALE SEED EXTRACT,90106-48-2,Secale cereale,Seed Extract,Liquid,Herbs,Secale cereale,term:secale cereale,post_merge_term_cluster,1,1,0,cosing
d48365748f1441b253d3c1c1c06351c94ea84d55,cosing,SECALE CEREALE SEED FLOUR,SECALE CEREALE SEED FLOUR,90106-48-2,Secale cereale,Flour,Powder,Grains,Secale cereale,term:secale cereale,post_merge_term_cluster,1,1,0,cosing
ab23ee1944efd6267709e66a01350600d329481e,cosing,TRITICUM AESTIVUM FLOUR LIPIDS,TRITICUM AESTIVUM FLOUR LIPIDS,84012-44-2,Triticum aestivum,Flour,Powder,Grains,Triticum Aestivum Seed,term:triticum aestivum,post_merge_term_cluster,1,1,0,cosing
03f5e860e553bd5c4a78f304b05e79d8c62748ab,cosing,TRITICUM VULGARE FLOUR EXTRACT,TRITICUM VULGARE FLOUR EXTRACT,84012-44-2,Triticum vulgare,Extract,Liquid,Grains,Triticum Aestivum Seed,term:triticum vulgare,post_merge_term_cluster,1,1,0,cosing
8b19b05280b9f212c62e3d154c81d29bff3338b0,cosing,TRITICUM VULGARE STARCH,TRITICUM VULGARE STARCH,9005-25-8,Triticum vulgare,Starch,Powder,Grains,Triticum vulgare,term:triticum vulgare,post_merge_term_cluster,1,1,0,cosing
0c0db5c4f8be078726444b20f200355680c55e89,cosing,TRITICUM VULGARE FLOUR LIPIDS,TRITICUM VULGARE FLOUR LIPIDS,84012-44-2,Triticum vulgare,Flour,Powder,Grains,Triticum Aestivum Seed,term:triticum vulgare kernel,post_merge_term_cluster,2,2,0,cosing
e5d7b9c3d126d5320d70ba62e5bd551a67e8b6f2,cosing,TRITICUM VULGARE KERNEL FLOUR,TRITICUM VULGARE KERNEL FLOUR,130498-22-5,Triticum vulgare,Flour,Powder,Grains,Triticum vulgare,term:triticum vulgare kernel,post_merge_term_cluster,2,2,0,cosing
