common_name,botanical_name,cas_number,einecs_number,fema_number,category,molecular_formula,molecular_weight,boiling_point,melting_point,density,odor_description,flavor_description,description,uses,safety_notes,solubility,synonyms,natural_occurrence,url
"abies alba leaf extract,",,90028-76-5,,,cosmetic_ingredients,,,,,,Type: balsamic,descriptions from others (if found),Information:,Information:,Information:,,abies alba extract from leaves abies alba extract from needles abies alba needle extract extract obtained from the needles of the fir abies alba; pinaceaesilver fir leaf extractsilver fir needle extract Articles: PubMed:Composition of essential oil from seeds and cones of Abies alba,ring self-gelation,https://www.thegoodscentscompany.com/data/ex1546831.html
"abies alba needle oil,",,8021-27-0,,,cosmetic_ingredients,,,,,0.86700,of this oil may also act as a great deodorant,"s, cosmetics, pharmaceuticals and Aromatherapy","(i,s,o,g,r,a,m){i['GoogleAnalyticsObject']=r;i[r]=i[r]||function(){(i[r]",m){i['GoogleAnalyticsObject']=r; i[r]=i[r]||function(){(i[r],Information:,"ethyl alcohol, 4 to 7 and more vol",ous with Christmas; Fir needle oil’s aroma is a wonderful addition throughout the year; bringing a woody; bright; fresh aroma to any product,ring self-gelation,https://www.thegoodscentscompany.com/data/es1026931.html
"balsam fir oleoresin,",,977017-81-4,,,cosmetic_ingredients,,,,,,Type: balsamic,and fragrance industries,d on the supply of essential oils and aromatic chemicals,d on the supply of essential oils and aromatic chemicals,Information:,alcohol Insoluble in: water Organoleptic Properties: Odor Type: balsamic Odor Strength:low Substantivity:400 hour(s) at 100,Articles Notes balsam fir oleoresin canadian balsam oleoresin Supplier Sponsors Berje Inc,the Pinacea family; including Pinus and Abies genera; should only be used when the level of peroxides is kept to the lowest practicable level; for instance by adding antioxidants at the time of production,https://www.thegoodscentscompany.com/data/ol1006601.html
"abies balsamea needle extract,",,85085-34-3,,,cosmetic_ingredients,,,,,,and/or flavor descriptions from others (if found),descriptions from others (if found),Information:,Information:,Information:,,balsam fir needle extract balsam fir needle extract (abies balsamea l,the Pinacea family; including Pinus and Abies genera; should only be used when the level of peroxides is kept to the lowest practicable level; for instance by adding antioxidants at the time of production,https://www.thegoodscentscompany.com/data/ex1546841.html
"balsam fir needle oil america,",,8024-15-5,,,cosmetic_ingredients,,,,,0.86050,Type: balsamic,"ing, coloring, fragrances and chemical processes",of these seven synthetic flavoring substances,of these seven synthetic flavoring substances,Information:,alcohol Insoluble in: water Organoleptic Properties: Odor Type: balsamic fresh terpenic fir needle Odor Description:at 100,Articles Notes balsam fir needle oil america abies balsamea needle oil Supplier Sponsors Global Essence Inc,the Pinacea family; including Pinus and Abies genera; should only be used when the level of peroxides is kept to the lowest practicable level; for instance by adding antioxidants at the time of production,https://www.thegoodscentscompany.com/data/es1006561.html
"fir needle oil canada,",,8021-28-1,,,cosmetic_ingredients,,,,,,Type: balsamic,and fragrance industries,d on the supply of essential oils and aromatic chemicals,d on the supply of essential oils and aromatic chemicals,Information:,"alcohol water, 4",Articles Notes fir needle oil canada abies balsamea needle oil canada Supplier Sponsors Berje Inc,s of ignition - No Smoking,https://www.thegoodscentscompany.com/data/es1018931.html
"fir balsam oleoresin canada,",,8024-15-5,,,cosmetic_ingredients,,,,,,Type: pine,and fragrance,d in conjunction with flavors,d in conjunction with flavors,Information:,alcohol Insoluble in: water Organoleptic Properties: Odor Type: pine Odor Strength:medium Substantivity:316 hour(s) at 100,Articles Notes fir balsam oleoresin canada abies balsamea oleoresin canada Supplier Sponsors Name:abies balsamea l,the Pinacea family; including Pinus and Abies genera; should only be used when the level of peroxides is kept to the lowest practicable level; for instance by adding antioxidants at the time of production,https://www.thegoodscentscompany.com/data/ol1001701.html
"abies balsamea sprout extract,",,85085-34-3,,,cosmetic_ingredients,,,,,,and/or flavor descriptions from others (if found),descriptions from others (if found),Information:,Information:,Information:,alcohol water Similar Items:note abies balsamea l,abies balsamea extractactiphyte of balsam canada extractcanadian balsam extract extract of the balsam canada; abies balsamea; pinaceae fir balsam extract pinus balsamea extract Articles: None found yet,the Pinacea family; including Pinus and Abies genera; should only be used when the level of peroxides is kept to the lowest practicable level; for instance by adding antioxidants at the time of production,https://www.thegoodscentscompany.com/data/ex1026991.html
