common_name,botanical_name,cas_number,einecs_number,fema_number,category,molecular_formula,molecular_weight,boiling_point,melting_point,density,odor_description,flavor_description,description,uses,safety_notes,solubility,synonyms,natural_occurrence,url
abalone extract,,,,,extracts,,,,,,and/or flavor descriptions from others (if found),descriptions from others (if found),Information:,Information:,Information:,"matrix fraction, extracted from the nacre of Pinctada maxima, in the regulation of cell activity in abalone mantle cell culture (Haliotis tuberculata)",,,https://www.thegoodscentscompany.com/data/ex1691321.html
abeliophyllum distichum extract,,,,,extracts,,,,,,and/or flavor descriptions from others (if found),descriptions from others (if found),Information:,Information:,Information:,,,,https://www.thegoodscentscompany.com/data/ex1691311.html
"abies alba cone extract,",,90028-76-5,,,extracts,,,,,,Type: woody,and fragrance,Information:,Information:,Information:,,extract obtained from the cones of the fir abies alba; pinaceaesilver fir cone extract fir cone extract silver Articles: PubMed:Combined analysis by GC (RI); GC-MS and 13C NMR of the supercritical fluid extract of Abies alba twigs,ring self-gelation,https://www.thegoodscentscompany.com/data/ex1546821.html
"abies alba extract (whole plant),",,90028-76-5,,,extracts,,,,,,Type: balsamic,descriptions from others (if found),Information:,Information:,Information:,,extract of the whole plant; abies alba; pinaceaesilver fir extract Articles: PubMed:Polyphenolic content and antioxidant activity of an extractive fraction from Abies alba bark,,https://www.thegoodscentscompany.com/data/ex1691331.html
"abies alba leaf extract,",,90028-76-5,,,extracts,,,,,,Type: balsamic,descriptions from others (if found),Information:,Information:,Information:,,abies alba extract from leaves abies alba extract from needles abies alba needle extract extract obtained from the needles of the fir abies alba; pinaceaesilver fir leaf extractsilver fir needle extract Articles: PubMed:Composition of essential oil from seeds and cones of Abies alba,ring self-gelation,https://www.thegoodscentscompany.com/data/ex1546831.html
"abies balsamea needle extract,",,85085-34-3,,,extracts,,,,,,and/or flavor descriptions from others (if found),descriptions from others (if found),Information:,Information:,Information:,,balsam fir needle extract balsam fir needle extract (abies balsamea l,the Pinacea family; including Pinus and Abies genera; should only be used when the level of peroxides is kept to the lowest practicable level; for instance by adding antioxidants at the time of production,https://www.thegoodscentscompany.com/data/ex1546841.html
"abies balsamea sprout extract,",,85085-34-3,,,extracts,,,,,,and/or flavor descriptions from others (if found),descriptions from others (if found),Information:,Information:,Information:,alcohol water Similar Items:note abies balsamea l,abies balsamea extractactiphyte of balsam canada extractcanadian balsam extract extract of the balsam canada; abies balsamea; pinaceae fir balsam extract pinus balsamea extract Articles: None found yet,the Pinacea family; including Pinus and Abies genera; should only be used when the level of peroxides is kept to the lowest practicable level; for instance by adding antioxidants at the time of production,https://www.thegoodscentscompany.com/data/ex1026991.html
abies koreana leaf extract,,,,,extracts,,,,,,and/or flavor descriptions from others (if found),descriptions from others (if found),Information:,Information:,Information:,,extract of the leaves of abies koreana; pinaceaekorean fir leaf extract Articles: PubMed:Comparative analysis of chemical compositions and antimicrobial activities of essential oils from Abies holophylla and Abies koreana activities of essential oils from Abies holophylla and Abies koreana,the Pinacea family; including Pinus and Abies genera; should only be used when the level of peroxides is kept to the lowest practicable level; for instance by adding antioxidants at the time of production,https://www.thegoodscentscompany.com/data/ex1664101.html
"abies pectinata bark/leaf extract,",,92128-34-2,,,extracts,,,,,,and/or flavor descriptions from others (if found),descriptions from others (if found),Information:,Information:,Information:,,extract of the bark and needles of the silver fir; abies pectinata; pinaceaesilver fir bark/leaf extract Articles: PubMed:Contrasting primary successional trajectories of fungi and bacteria in retreating glacier soils,the Pinacea family; including Pinus and Abies genera; should only be used when the level of peroxides is kept to the lowest practicable level; for instance by adding antioxidants at the time of production,https://www.thegoodscentscompany.com/data/ex1600951.html
"abies pectinata needle extract,",,92128-34-2,,,extracts,,,,,,and/or flavor descriptions from others (if found),descriptions from others (if found),Information:,Information:,Information:,alcohol water Similar Items:note abies pectinata bark/leaf extract abies pectinata needle oil Organoleptic Properties: Odor and/or flavor descriptions from others (if found),Articles Notes abies pectinata needle extract extract obtained from the bark and needles of the silver fir; abies pectinata; pinaceae,the Pinacea family; including Pinus and Abies genera; should only be used when the level of peroxides is kept to the lowest practicable level; for instance by adding antioxidants at the time of production,https://www.thegoodscentscompany.com/data/ex1546851.html
abies sachalinensis branch/leaf water,,,,,extracts,,,,,,and/or flavor descriptions from others (if found),descriptions from others (if found),Information:,Information:,Information:,,abies gracilis branch/leaf water abies wilsonii branch/leaf water picea jezoensis carr,the branches and leaves of abies sachalinensis; pinaceae,https://www.thegoodscentscompany.com/data/ex1703071.html
abies sachalinensis leaf extract,,,,,extracts,,,,,,and/or flavor descriptions from others (if found),descriptions from others (if found),Information:,Information:,Information:,,abies gracilis leaf extract abies wilsonii leaf extract extract of the leaves of abies sachalinensis; pinaceae picea jezoensis carr,,https://www.thegoodscentscompany.com/data/ex1691341.html
"abies sibirica needle extract,",,91697-89-1,,,extracts,,,,,,Type: pine,descriptions from others (if found),Information:,Information:,Information:,,extract obtained from the needles and branches of the fir; abies sibirica; pinaceeae fir needle extract siberia Articles: PubMed:Structural studies of the pectic polysaccharide from Siberian fir (Abies sibirica Ledeb,the Pinacea family; including Pinus and Abies genera; should only be used when the level of peroxides is kept to the lowest practicable level; for instance by adding antioxidants at the time of production,https://www.thegoodscentscompany.com/data/ex1546871.html
abronia villosa leaf extract,,,,,extracts,,,,,,and/or flavor descriptions from others (if found),descriptions from others (if found),Information:,Information:,Information:,,extract of the leaves of abronia villosa; nyctaginaceaedesert sand verbena leaf extractdesert sand-verbena leaf extract Articles: PubMed:Abronione; a rotenoid from the desert annual Abronia villosa,,https://www.thegoodscentscompany.com/data/ex1691351.html
abrus fructiculosus root extract,,,,,extracts,,,,,,and/or flavor descriptions from others (if found),descriptions from others (if found),Information:,Information:,Information:,,abrus fruticulosus root extract extract of the roots of abrus fructiculosus; fabaceae Articles: None found yet,,https://www.thegoodscentscompany.com/data/ex1691361.html
"abies alba cone oil,",,8021-27-0,,,essential_oils,,,150.00,,0.85100,Type: balsamic,ing and Related SubstancesSec,d in conjunction with flavors,d in conjunction with flavors,Information:,"alcohol water, 4",Articles Notes abies alba cone oil essential oil obtained from the cones of the fir abies alba; pinaceae Supplier Sponsors TERPENA S,ring self-gelation,https://www.thegoodscentscompany.com/data/es1000121.html
"abies alba needle oil,",,8021-27-0,,,essential_oils,,,,,0.86700,of this oil may also act as a great deodorant,"s, cosmetics, pharmaceuticals and Aromatherapy","(i,s,o,g,r,a,m){i['GoogleAnalyticsObject']=r;i[r]=i[r]||function(){(i[r]",m){i['GoogleAnalyticsObject']=r; i[r]=i[r]||function(){(i[r],Information:,"ethyl alcohol, 4 to 7 and more vol",ous with Christmas; Fir needle oil’s aroma is a wonderful addition throughout the year; bringing a woody; bright; fresh aroma to any product,ring self-gelation,https://www.thegoodscentscompany.com/data/es1026931.html
"abies alba seed oil,",,8021-27-0,,,essential_oils,,,,,,and/or flavor descriptions from others (if found),descriptions from others (if found),Information:,Information:,Information:,alcohol Insoluble in: water Organoleptic Properties: Odor and/or flavor descriptions from others (if found),Articles Notes abies alba seed oil Supplier Sponsors TERPENA S,,https://www.thegoodscentscompany.com/data/es1002421.html
abies amabilis oil canada,,,,,essential_oils,,,,,0.85200,Type: fir needle,descriptions from others (if found),Information:,Information:,Information:,alcohol Insoluble in: water Organoleptic Properties: Odor Type: fir needle Odor Strength:medium Substantivity:12 hour(s) at 100,amabilis fir oilpacific silver fir oil (abies amabilis) canadasilver fir oil pacific (abies amabilis) Articles: PubMed:Eyeing emergence: modified treatments for terminating dormancy of conifer seeds,the Pinacea family; including Pinus and Abies genera; should only be used when the level of peroxides is kept to the lowest practicable level; for instance by adding antioxidants at the time of production,https://www.thegoodscentscompany.com/data/es1096481.html
"abies balsamea bark oil,",,8024-15-5,,,essential_oils,,,,,,Type: woody,descriptions from others (if found),Information:,Information:,Information:,alcohol Insoluble in: water Organoleptic Properties: Odor Type: woody woody Odor Description:woody Odor and/or flavor descriptions from others (if found),Articles Notes abies balsamea bark oil silver fir bark oil (abies balsamea l,,https://www.thegoodscentscompany.com/data/es1080831.html
abies grandis oil canada,,,,,essential_oils,,,,,0.88200,Type: woody,descriptions from others (if found),Information:,Information:,Information:,alcohol Insoluble in: water Organoleptic Properties: Odor Type: woody Odor Strength:medium Substantivity:16 hour(s) at 100,grand fir oil (abies grandis) fir oil grand (abies grandis) Articles: PubMed:Altering product outcome in Abies grandis (-)-limonene synthase and (-)-limonene/(-)-alpha-pinene synthase by domain swapping and directed mutagenesis,s of variation in ecophysiological parameters in Douglas-fir and grand fir canopies,https://www.thegoodscentscompany.com/data/es1096461.html
abies koreana seed oil,,,,,essential_oils,,,,,,and/or flavor descriptions from others (if found),descriptions from others (if found),Information:,Information:,Information:,alcohol Insoluble in: water Organoleptic Properties: Odor and/or flavor descriptions from others (if found),korean fir seed oil Articles: PubMed:Composition of essential oils from seeds of Abies koreana,the Pinacea family; including Pinus and Abies genera; should only be used when the level of peroxides is kept to the lowest practicable level; for instance by adding antioxidants at the time of production,https://www.thegoodscentscompany.com/data/es1095881.html
abies lasiocarpa oil canada,,,,,essential_oils,,,,,0.86700,Type: woody,descriptions from others (if found),Information:,Information:,Information:,alcohol Organoleptic Properties: Odor Type: woody Odor Strength:medium Substantivity:20 hour(s) at 100,fir oil subalpine (abies lasiocarpa)subalpine fir oil (abies lasiocarpa) pinus lasiocarpa oil canada Articles: PubMed:Contrasting primary successional trajectories of fungi and bacteria in retreating glacier soils,s on the population dynamics of a northern rodent,https://www.thegoodscentscompany.com/data/es1096491.html
"abies pectinata needle oil,",,92128-34-2,,,essential_oils,,,,,,Type: woody,descriptions from others (if found),Information:,Information:,Information:,alcohol Insoluble in: water Similar Items:note abies pectinata bark/leaf extract abies pectinata leaf extract Organoleptic Properties: Odor Type: woody woody pine Odor Description:at 100,Articles Notes abies pectinata needle oil essential oil obtained from the needles of the fir; abies pectinata; pinacea,the Pinacea family; including Pinus and Abies genera; should only be used when the level of peroxides is kept to the lowest practicable level; for instance by adding antioxidants at the time of production,https://www.thegoodscentscompany.com/data/es1546861.html
"abies pectinata wood oil,",,92128-34-2,,,essential_oils,,,,,,and/or flavor descriptions from others (if found),descriptions from others (if found),Information:,Information:,Information:,,silver fir wood oil volatile oil obtained from the wood of abies pectinata; pinaceae Articles: None found yet,the wood of abies pectinata; pinaceae,https://www.thegoodscentscompany.com/data/es1703061.html
abies sachalinensis leaf oil,,,,,essential_oils,,,,,,and/or flavor descriptions from others (if found),descriptions from others (if found),Information:,Information:,Information:,alcohol Insoluble in: water Organoleptic Properties: Odor and/or flavor descriptions from others (if found),Articles Notes abies sachalinensis leaf oil volatile oil obtained from the leaves of abies sachalinensis; pinaceae Supplier Sponsors TERPENA S,the Pinacea family; including Pinus and Abies genera; should only be used when the level of peroxides is kept to the lowest practicable level; for instance by adding antioxidants at the time of production,https://www.thegoodscentscompany.com/data/es1539081.html
acacia farnesiana flower oil,,,,,essential_oils,,,,,,and/or flavor descriptions from others (if found),and fragrance,Information:,Information:,Information:,alcohol Insoluble in: water Organoleptic Properties: Odor and/or flavor descriptions from others (if found),Articles Notes acacia farnesiana flower oil volatile oil obtained from the flowers of acacia farnesiana; fabaceae Supplier Sponsors Zanos Ltd,for aroma chemicals and essential oils,https://www.thegoodscentscompany.com/data/es1687851.html
acanthopanax koreanum oil,,,,,essential_oils,,,,,,and/or flavor descriptions from others (if found),descriptions from others (if found),Information:,Information:,Information:,,volatile oil obtained from the whole plant; acanthopanax koreanum Articles: None found yet,the whole plant; acanthopanax koreanum,https://www.thegoodscentscompany.com/data/es1703131.html
"achillea millefolium flower water,",,84082-83-7,,,essential_oils,,,,,,and/or flavor descriptions from others (if found),descriptions from others (if found),Milfoil water is very beneficial for skin problems such as acne and oily skin,Milfoil water is very beneficial for skin problems such as acne and oily skin,Information:,water Organoleptic Properties: Odor and/or flavor descriptions from others (if found),Articles Notes achillea millefolium flower water aqueous solution of the steam distillated obtained from the flowers of the yarrow; achillea millefolium l,the flowers of the yarrow; achillea millefolium l,https://www.thegoodscentscompany.com/data/es1617881.html
"achillea millefolium herb oil CO2 extract,",,8022-07-9,,,essential_oils,,,,,,Type: floral,and fragrance,d in conjunction with flavors,d in conjunction with flavors,Information:,alcohol Insoluble in: water Organoleptic Properties: Odor Type: floral floral beeswax chamomile rosemary thyme minty tarragon smoky mossy Odor Description:at 100,Articles Notes achillea millefolium herb oil CO2 extract yarrow oil CO2 extract Supplier Sponsors Hermitage Oils / Neroli S,,https://www.thegoodscentscompany.com/data/es1088441.html
"acacia mearnsii flower absolute,",,68911-60-4,,,absolutes,,,,,,and/or flavor descriptions from others (if found),descriptions from others (if found),"LD50 40 mg/kgKIDNEY, URETER, AND BLADDER: URINE VOLUME INCREASED VASCULAR: OTHER CHANGESIndian Journal of Experimental Biology",LD50 40 mg/kgKIDNEY; URETER; AND BLADDER: URINE VOLUME INCREASED VASCULAR: OTHER CHANGESIndian Journal of Experimental Biology,Information:,alcohol Insoluble in: water Organoleptic Properties: Odor and/or flavor descriptions from others (if found),acacia decurrens var,,https://www.thegoodscentscompany.com/data/ab1671311.html
"aglaia odorata absolute,",,85480-33-7,,,absolutes,,,,,0.87000,"ata absolute, 85480-33-7",& Fragrances industries worldwide,in Flavor & Fragrances industries worldwide,in Flavor & Fragrances industries worldwide,Information:,alcohol Insoluble in: water Organoleptic Properties: Odor Type: floral green floral leathery fruity herbal woody spicy Odor Description:at 100,Articles Notes aglaia odorata absolute aglaia odorata var,,https://www.thegoodscentscompany.com/data/ab1067541.html
"alfa alsolute,",,68952-68-1,,,absolutes,,,,,,and/or flavor descriptions from others (if found),descriptions from others (if found),Information:,Information:,Information:,alcohol Insoluble in: water Organoleptic Properties: Odor and/or flavor descriptions from others (if found),stipa teracissima alsolute Articles: None found yet,,https://www.thegoodscentscompany.com/data/ab1080371.html
"alfalfa absolute,",,84082-36-0,,,absolutes,,,,,,Type: green,descriptions from others (if found),Information:,Information:,Information:,alcohol Insoluble in: water Organoleptic Properties: Odor Type: green green grassy weedy ocean seashore Odor Description:at 100,medicago sativa absolute Articles: None found yet,,https://www.thegoodscentscompany.com/data/ab1092731.html
"green algae absolute,",,68917-51-1,,,absolutes,,,,,,Type: marine,& Specialty Ingredients,"This algae is mainly used in the food industry and can be found in many processed products such as yogurt, milk, chocolate or even beer",This algae is mainly used in the food industry and can be found in many processed products such as yogurt; milk; chocolate or even beer,Information:,,Articles Notes green algae absolute Supplier Sponsors Argeville SAS The experts in fragrances Argeville always aims to satisfy the market and its clients,many processed products such as yogurt; milk; chocolate or even beer,https://www.thegoodscentscompany.com/data/ab1000651.html
"allspice berry absolute,",,8006-77-7,,,absolutes,,,,,,Type: spicy,and fragrance,sensitisation by inhalation,sensitisation by inhalation,Information:,"alcohol water, 754 mg/L @ 25 °C (est) Insoluble in: water Organoleptic Properties: Odor Type: spicy sweet warm spicy woody clove Odor Description:at 100",Articles Notes allspice berry absolute Supplier Sponsors Name:pimenta officinalis lindl,,https://www.thegoodscentscompany.com/data/ab1054931.html
alyxia oliviformis absolute,,,,,absolutes,,,,,,and/or flavor descriptions from others (if found),descriptions from others (if found),Information:,Information:,Information:,alcohol Insoluble in: water Organoleptic Properties: Odor and/or flavor descriptions from others (if found),maile vine absolute Articles: None found yet,,https://www.thegoodscentscompany.com/data/ab1671301.html
"ambrette seed absolute,",,84455-19-6,,,absolutes,,,298.00 °C.,,0.89800,Type: amber,s LLC and Polarome International,rs of natural ingredients,rs of natural ingredients,Information:,,Articles Notes ambrette seed absolute abelmoschus moschatus seed absolute Supplier Sponsors Augustus Oils Ltd The Premier Supplier Augustus Oils Ltd; in harmony with nature - to present it at its best,d from around the world; our F&F ingredient inventory in Singapore is ready to ship to any location in Asia and beyond,https://www.thegoodscentscompany.com/data/ab1029391.html
angelica root absolute,,,,,absolutes,,,,,,Type: musk,and fragrance,Information:,Information:,Information:,,Articles Notes angelica root absolute angelica archangelica root absolute Supplier Sponsors Robertet; Inc,,https://www.thegoodscentscompany.com/data/ab1068081.html
"angelica seed absolute,",Rboxwood blossom,8015-64-3,,,absolutes,,,,,,Type: spicy,and fragrance,LD50 2200 mg/kgFood and Cosmetics Toxicology,LD50 2200 mg/kgFood and Cosmetics Toxicology,Information:,"alcohol water, 2",Articles Notes angelica seed absolute angelica archangelica seed absolute Supplier Sponsors Robertet; Inc,,https://www.thegoodscentscompany.com/data/ab1604531.html
angelica sinensis root absolute,,,,,absolutes,,,,,,Type: spicy,descriptions from others (if found),Information:,Information:,Information:,alcohol Insoluble in: water Organoleptic Properties: Odor Type: spicy spicy rooty green resinous smoky Odor Description:at 100,angelica root absolute (angelica sinensis) danggui root absolute dong quai root absolute Articles: None found yet,,https://www.thegoodscentscompany.com/data/ab1592211.html
anise seed absolute,,,,,absolutes,,,,,,Type: anise,and fragrance,Information:,Information:,Information:,", kinetics, and composition data",anise absolute anise seed absolute (pimpinella anisum) aniseed absolute pimpinella anisum fruit absolute pimpinella anisum seed absolute Articles: PubMed:Antibacterial activity against Clostridium genus and antiradical activity of the essential oils from different origin,ring cytokinin (6-benzylaminopurineriboside) from an anise cell culture (Pimpinella anisum L,https://www.thegoodscentscompany.com/data/ab1657301.html
armoise absolute,Chrysanthemum via,,,,absolutes,,,,,,and/or flavor descriptions from others (if found),descriptions from others (if found),Information:,Information:,Information:,,artemisia vulgaris absolute artemisia opulenta absolute artemisia vulgaris var,plants grown in Colombia on yellow fever virus replication in vitro,https://www.thegoodscentscompany.com/data/ab1092781.html
"arnica flower absolute,",,68990-11-4,,,absolutes,,,,,,Type: herbal,descriptions from others (if found),"Adam Michael has this to say “Arnica Flower Absolute is produced by solvent extracting the flower heads, golden yellow to amber-brown in colour, and of a pourable to semi-solid viscosity",Adam Michael has this to say “Arnica Flower Absolute is produced by solvent extracting the flower heads; golden yellow to amber-brown in colour; and of a pourable to semi-solid viscosity,Information:,alcohol Insoluble in: water Organoleptic Properties: Odor Type: herbal herbal sweet tea chamomile woody earthy Odor Description:at 100,Articles Notes arnica flower absolute arnica flowers absolute (arnica spp,,https://www.thegoodscentscompany.com/data/ab1068191.html
"artemisia pallens herb absolute,",,8016-03-3,,,absolutes,,,,,,Type: herbal,and fragrance,Information:,Information:,Information:,alcohol Insoluble in: water Organoleptic Properties: Odor Type: herbal herbal resinous amber balsamic floral Odor Description:at 100,Articles Notes artemisia pallens herb absolute absolute obtained from the whole herbs of the plant; artemisia pallens; compositae Supplier Sponsors Name:artemisia pallens wall,the whole herbs of the plant; artemisia pallens; compositae,https://www.thegoodscentscompany.com/data/ab1084931.html
annona emarginata fruit,,,,,aromatic_ingredients,,,,,,and/or flavor descriptions from others (if found),descriptions from others (if found),d for fragrances or flavors,d for fragrances or flavors,Information:,,corosol fruit rollinia emarginata fruit rollinia emarginata var,,https://www.thegoodscentscompany.com/data/rw1916071.html
"abamectin,",,71751-41-2,,,aromatic_ingredients,,1732.15434000,,,,and/or flavor descriptions from others (if found),descriptions from others (if found),d insecticide and anthelmintic,d insecticide and anthelmintic,Information:,,avermectin b1 Articles: PubMed:Relative potency of macrocyclic lactones in in vitro assays with larvae of susceptible and drug-resistant Australian isolates of Haemonchus contortus and H,nature Synonyms: avermectin b1 Articles: PubMed:Relative potency of macrocyclic lactones in in vitro assays with larvae of susceptible and drug-resistant Australian isolates of Haemonchus contortus and H,https://www.thegoodscentscompany.com/data/rw1341221.html
"3(4->5)-abeo-4,11:4,12-diepoxy-3-eudesmanol,",,210106-16-4,,,aromatic_ingredients,,252.35388000,,,,and/or flavor descriptions from others (if found),descriptions from others (if found),Information:,Information:,Information:,"water, 134 mg/L @ 25 °C (est) Organoleptic Properties: Odor and/or flavor descriptions from others (if found)",Articles Notes 3(4->5)-abeo-4; 11:4; 12-diepoxy-3-eudesmanol N-(morpholinomethyl)nicotinamide Supplier Sponsors CAS Number: 210106-16-43D/inchi FDA UNII: XlogP3:2,,https://www.thegoodscentscompany.com/data/rw1829841.html
"(7alpha,10beta)-1(10->19)-abeo-7-acetoxyisoobacun-3,10-olide,",,85643-98-7,,,aromatic_ingredients,,514.57178000,,,,and/or flavor descriptions from others (if found),descriptions from others (if found),Information:,Information:,Information:,"water, 1",Articles Notes (7alpha; 10beta)-1(10->19)-abeo-7-acetoxyisoobacun-3; 10-olide Supplier Sponsors CAS Number: 85643-98-73D/inchi FDA UNII: XlogP3-AA:2,,https://www.thegoodscentscompany.com/data/rw1847551.html
"7alpha-1(10->19)-abeo-7-acetoxyobacun-9(11)-ene,",,85643-97-6,,,aromatic_ingredients,,496.55664000,,,,and/or flavor descriptions from others (if found),descriptions from others (if found),Information:,Information:,Information:,"water, 3",Articles Notes 7alpha-1(10->19)-abeo-7-acetoxyobacun-9(11)-ene Supplier Sponsors CAS Number: 85643-97-63D/inchi FDA UNII: Molecular Weight:496,,https://www.thegoodscentscompany.com/data/rw1853251.html
